{
  "$schema": "../pmresource.schema.json",
  "name": "pm-interactions",
  "version": "0.8.0",
  "description": "Shared room/entity contextual interaction registry without 3D targeting.",
  "server": "server.mjs",
  "dependencies": [],
  "heartbeat": {
    "events": {
      "interaction:used": "never"
    }
  },
  "clientActions": [
    "interaction:list",
    "interaction:run"
  ]
}
